{
  "$schema": "./catalog.schema.json",
  "generatedFrom": "app.js (migration unique)",
  "note": "apps.json est desormais la source de verite du catalogue. Editez-le directement (validé par catalog.schema.json). L'ordre est celui de l'affichage.",
  "count": 93,
  "applications": [
    {
      "id": "Google.Chrome",
      "name": "Google Chrome",
      "category": "Navigateurs",
      "desc": "Navigateur rapide et sécurisé",
      "icon": "CH",
      "color": "#4285f4",
      "site": "https://www.google.com/chrome/",
      "logo": "assets/logos/googlechrome.svg",
      "tags": [
        "essentiel"
      ]
    },
    {
      "id": "Mozilla.Firefox",
      "name": "Mozilla Firefox",
      "category": "Navigateurs",
      "desc": "Navigateur libre et respectueux",
      "icon": "FF",
      "color": "#ff7139",
      "site": "https://www.mozilla.org/firefox/new/",
      "logo": "assets/logos/firefox.svg"
    },
    {
      "id": "Brave.Brave",
      "name": "Brave",
      "category": "Navigateurs",
      "desc": "Navigation privée avec bloqueur intégré",
      "icon": "BR",
      "color": "#fb542b",
      "site": "https://brave.com/download/",
      "logo": "assets/logos/brave.svg"
    },
    {
      "id": "Vivaldi.Vivaldi",
      "name": "Vivaldi",
      "category": "Navigateurs",
      "desc": "Navigateur personnalisable avec outils intégrés",
      "icon": "VI",
      "color": "#ef3939",
      "site": "https://vivaldi.com/download/",
      "logo": "assets/logos/vivaldi.svg",
      "repairMode": "reinstall"
    },
    {
      "id": "Opera.Opera",
      "name": "Opera",
      "category": "Navigateurs",
      "desc": "Navigateur moderne avec VPN et outils intégrés",
      "icon": "OP",
      "color": "#e51d5f",
      "site": "https://www.opera.com/download",
      "logo": "assets/logos/opera.svg",
      "repairMode": "reinstall"
    },
    {
      "id": "Opera.OperaGX",
      "name": "Opera GX",
      "category": "Navigateurs",
      "desc": "Navigateur conçu pour le gaming et le contrôle des ressources",
      "icon": "GX",
      "color": "#c728f2",
      "site": "https://www.opera.com/gx",
      "logo": "assets/logos/operagx-color.svg",
      "tags": [
        "gaming"
      ],
      "repairMode": "reinstall"
    },
    {
      "id": "LibreWolf.LibreWolf",
      "name": "LibreWolf",
      "category": "Navigateurs",
      "desc": "Version renforcée de Firefox orientée confidentialité",
      "icon": "LW",
      "color": "#546f91",
      "site": "https://librewolf.net/installation/windows/",
      "logo": "assets/logos/librewolf.svg",
      "repairMode": "reinstall"
    },
    {
      "id": "Ablaze.Floorp",
      "name": "Floorp",
      "category": "Navigateurs",
      "desc": "Navigateur Firefox personnalisable et respectueux de la vie privée",
      "icon": "FL",
      "color": "#4e7ce2",
      "site": "https://floorp.app/download/",
      "logo": "assets/logos/floorp.svg",
      "repairMode": "reinstall"
    },
    {
      "id": "TorProject.TorBrowser",
      "name": "Tor Browser",
      "category": "Navigateurs",
      "desc": "Navigation privée via le réseau Tor",
      "icon": "TOR",
      "color": "#7d4698",
      "site": "https://www.torproject.org/download/",
      "logo": "assets/logos/torbrowser-color.svg",
      "repairMode": "reinstall"
    },
    {
      "id": "Waterfox.Waterfox",
      "name": "Waterfox",
      "category": "Navigateurs",
      "desc": "Navigateur indépendant basé sur Firefox",
      "icon": "WF",
      "color": "#3d8fe7",
      "site": "https://www.waterfox.net/download/",
      "logo": "assets/logos/waterfox-color.svg",
      "repairMode": "reinstall"
    },
    {
      "id": "7zip.7zip",
      "name": "7-Zip",
      "category": "Utilitaires",
      "desc": "Compression et extraction de fichiers",
      "icon": "7z",
      "color": "#596477",
      "site": "https://www.7-zip.org/download.html",
      "logo": "assets/logos/sevenzip.svg",
      "tags": [
        "essentiel"
      ]
    },
    {
      "id": "VideoLAN.VLC",
      "name": "VLC media player",
      "category": "Multimédia",
      "desc": "Lecteur audio et vidéo universel",
      "icon": "▶",
      "color": "#f08a24",
      "site": "https://www.videolan.org/vlc/",
      "logo": "assets/logos/vlc.png",
      "tags": [
        "essentiel"
      ]
    },
    {
      "id": "Notepad++.Notepad++",
      "name": "Notepad++",
      "category": "Utilitaires",
      "desc": "Éditeur de texte rapide et léger",
      "icon": "N+",
      "color": "#72a13e",
      "site": "https://notepad-plus-plus.org/downloads/",
      "logo": "assets/logos/notepadpp.svg",
      "tags": [
        "essentiel"
      ]
    },
    {
      "id": "SumatraPDF.SumatraPDF",
      "name": "Sumatra PDF",
      "category": "Bureautique",
      "desc": "Lecteur PDF simple et très rapide",
      "icon": "PDF",
      "color": "#e8b536",
      "site": "https://www.sumatrapdfreader.org/download-free-pdf-viewer",
      "logo": "assets/logos/sumatrapdf.ico",
      "tags": [
        "essentiel"
      ]
    },
    {
      "id": "TheDocumentFoundation.LibreOffice",
      "name": "LibreOffice",
      "category": "Bureautique",
      "desc": "Suite bureautique complète et libre",
      "icon": "LO",
      "color": "#18a05e",
      "site": "https://www.libreoffice.org/download/download-libreoffice/",
      "logo": "assets/logos/libreoffice.svg",
      "tags": [
        "essentiel"
      ]
    },
    {
      "id": "voidtools.Everything",
      "name": "Everything",
      "category": "Utilitaires",
      "desc": "Recherche instantanée de fichiers",
      "icon": "E",
      "color": "#f2c94c",
      "site": "https://www.voidtools.com/downloads/",
      "logo": "assets/logos/everything.ico",
      "tags": [
        "essentiel"
      ]
    },
    {
      "id": "Microsoft.PowerToys",
      "name": "Microsoft PowerToys",
      "category": "Utilitaires",
      "desc": "Outils avancés pour Windows",
      "icon": "PT",
      "color": "#4b7bec",
      "site": "https://learn.microsoft.com/windows/powertoys/install",
      "logo": "assets/logos/powertoys.png",
      "tags": [
        "essentiel",
        "dev"
      ]
    },
    {
      "id": "Discord.Discord",
      "name": "Discord",
      "category": "Communication",
      "desc": "Messages, appels et communautés",
      "icon": "DC",
      "color": "#5865f2",
      "site": "https://discord.com/download",
      "logo": "assets/logos/discord.svg",
      "tags": [
        "gaming"
      ]
    },
    {
      "id": "Valve.Steam",
      "name": "Steam",
      "category": "Gaming",
      "desc": "Bibliothèque et plateforme de jeux",
      "icon": "ST",
      "color": "#2775a8",
      "site": "https://store.steampowered.com/about/",
      "logo": "assets/logos/steam.svg",
      "tags": [
        "gaming"
      ]
    },
    {
      "id": "EpicGames.EpicGamesLauncher",
      "name": "Epic Games",
      "category": "Gaming",
      "desc": "Launcher et boutique Epic Games",
      "icon": "EP",
      "color": "#3a3a3a",
      "site": "https://store.epicgames.com/download",
      "logo": "assets/logos/epicgames.svg",
      "tags": [
        "gaming"
      ]
    },
    {
      "id": "GOG.Galaxy",
      "name": "GOG Galaxy",
      "category": "Gaming",
      "desc": "Bibliothèque de jeux sans DRM",
      "icon": "GG",
      "color": "#883edb",
      "site": "https://www.gog.com/galaxy",
      "logo": "assets/logos/gog.svg",
      "tags": [
        "gaming"
      ]
    },
    {
      "id": "Ubisoft.Connect",
      "name": "Ubisoft Connect",
      "category": "Gaming",
      "desc": "Launcher des jeux Ubisoft",
      "icon": "UC",
      "color": "#149dda",
      "site": "https://www.ubisoft.com/en-gb/ubisoft-connect/download",
      "logo": "assets/logos/ubisoft.svg",
      "tags": [
        "gaming"
      ]
    },
    {
      "id": "OBSProject.OBSStudio",
      "name": "OBS Studio",
      "category": "Multimédia",
      "desc": "Enregistrement et streaming vidéo",
      "icon": "OB",
      "color": "#7e6bf2",
      "site": "https://obsproject.com/download",
      "logo": "assets/logos/obs.svg",
      "tags": [
        "gaming"
      ]
    },
    {
      "id": "Microsoft.VisualStudioCode",
      "name": "Visual Studio Code",
      "category": "Développement",
      "desc": "Éditeur de code extensible",
      "icon": "VS",
      "color": "#168bd2",
      "site": "https://code.visualstudio.com/download",
      "logo": "assets/logos/vscode.svg",
      "tags": [
        "dev"
      ]
    },
    {
      "id": "Git.Git",
      "name": "Git",
      "category": "Développement",
      "desc": "Gestion de versions distribuée",
      "icon": "G",
      "color": "#f05032",
      "site": "https://git-scm.com/download/win",
      "logo": "assets/logos/git.svg",
      "tags": [
        "dev"
      ]
    },
    {
      "id": "OpenJS.NodeJS.LTS",
      "name": "Node.js LTS",
      "category": "Composants",
      "desc": "Runtime JavaScript longue durée",
      "icon": "JS",
      "color": "#68a063",
      "site": "https://nodejs.org/en/download",
      "logo": "assets/logos/nodejs.svg",
      "tags": [
        "dev"
      ]
    },
    {
      "id": "Python.Python.3.13",
      "name": "Python 3",
      "category": "Composants",
      "desc": "Langage et environnement Python",
      "icon": "PY",
      "color": "#3776ab",
      "site": "https://www.python.org/downloads/windows/",
      "logo": "assets/logos/python.svg",
      "tags": [
        "dev"
      ]
    },
    {
      "id": "Microsoft.DotNet.DesktopRuntime.8",
      "name": ".NET Desktop Runtime 8",
      "category": "Composants",
      "desc": "Composant pour applications .NET",
      "icon": ".N",
      "color": "#6e4bc5",
      "site": "https://dotnet.microsoft.com/en-us/download/dotnet/8.0",
      "logo": "assets/logos/dotnet.svg",
      "tags": [
        "dev"
      ]
    },
    {
      "id": "Microsoft.VCRedist.2015+.x64",
      "name": "Visual C++ Runtime",
      "category": "Composants",